### ISSUE TITLE
CNAME Record Lookup Causes Failures

### ISSUE THREAD

**Issue by PFacheris** [Mashape/lua-resty-dns-client#14]
I was attempting to deploy a Kong (`0.10.2` Debian packaged, `0.4.1-1` of this library) instance to production today and ran into failures related to DNS resolution causing requests to randomly return 500 and the following message in the error logs:
```
[error] 24099#0: *60095 [lua] responses.lua:107: before(): failed the initial dns/balancer resolve for 'thorondor-ibapi.domain.net' with: dns query returned no results, client: ---, server: kong, request: "GET /thorondor/admin/status HTTP/1.1", host: "api.com"
```

Kong is configured with the following API matching the `api.domain.com` host:
```
{
      "hosts": [
        "api.domain.com",
        "st.domain.com",
        "api.domain.net"
      ],
      "name": "thorondor_ibapi_default",
      "strip_uri": false,
      "upstream_read_timeout": 60000,
      "https_only": false,
      "http_if_terminated": true,
      "id": "f67645c4-eb35-4e49-ae62-51904038f462",
      "retries": 5,
      "preserve_host": true,
      "created_at": 1494460913058,
      "upstream_connect_timeout": 60000,
      "upstream_url": "http://thorondor-ibapi.domain.net:80",
      "upstream_send_timeout": 60000
    },
```

```
 $ dig thorondor-ibapi.domain.net

; <<>> DiG 9.9.5-3ubuntu0.13-Ubuntu <<>> thorondor-ibapi.domain.net
;; global options: +cmd
;; Got answer:
;; ->>HEADER<<- opcode: QUERY, status: NOERROR, id: 52714
;; flags: qr rd ra; QUERY: 1, ANSWER: 2, AUTHORITY: 0, ADDITIONAL: 1

;; OPT PSEUDOSECTION:
; EDNS: version: 0, flags:; udp: 4096
;; QUESTION SECTION:
;thorondor-ibapi.domain.net.	IN	A

;; ANSWER SECTION:
thorondor-ibapi.domain.net. 30	IN	CNAME	thorondor-ibapi-ams1.domain.net.
thorondor-ibapi-ams1.domain.net.	30 IN	A	37.252.161.229

;; Query time: 3 msec
;; SERVER: 37.252.161.63#53(37.252.161.63)
;; WHEN: Thu May 11 22:28:45 UTC 2017
;; MSG SIZE  rcvd: 105
```

The TTL of the DNS record is 30 seconds and I'm able to reproduce the issue easily by repeated curls (3-4 failures every 30 seconds):
```
$ for i in {1..10000}; do curl -H "Host: api.com" 06.wsp-gateway.prod.ams1.domain.net/thorondor/admin/status; date; sleep .1; done;
{"message":"An unexpected error occurred"}
Thu May 11 21:59:15 UTC 2017
{"message":"An unexpected error occurred"}
Thu May 11 21:59:16 UTC 2017
{"message":"An unexpected error occurred"}
Thu May 11 21:59:16 UTC 2017
{"message":"An unexpected error occurred"}
Thu May 11 21:59:16 UTC 2017
status: upThu May 11 21:59:16 UTC 2017
...
status: upThu May 11 21:59:45 UTC 2017
status: upThu May 11 21:59:45 UTC 2017
{"message":"An unexpected error occurred"}
Thu May 11 21:59:46 UTC 2017
{"message":"An unexpected error occurred"}
Thu May 11 21:59:46 UTC 2017
{"message":"An unexpected error occurred"}
Thu May 11 21:59:46 UTC 2017
{"message":"An unexpected error occurred"}
Thu May 11 21:59:47 UTC 2017
```

By capturing DNS query information, it seems something may be causing the resolver to choke on the thorondor-ibapi.domain.net CNAME record before finally getting things sorted (this time span isn't covered in the above logs but occurred on the next 30 second interval and had the same error):
```
22:00:17.799393 IP 06.wsp-gateway.prod.ams1.38922 > intdnsrecurse01.ams1.domain.net.domain: 19301+ CNAME? thorondor-ibapi.domain.net. (43)
E..G].@.@..p
.@.%..>.
.5.3..Ke...........thorondor-ibapi.domain.net.....
22:00:17.803277 IP intdnsrecurse01.ams1.domain.net.domain > 06.wsp-gateway.prod.ams1.38922: 19301 0/1/0 (108)
E...li..?...%..>
.@..5.
.t:.Ke...........thorondor-ibapi.domain.net................5.ns1.gslb.com..support.domain."......Q.......Q.....
22:00:17.803481 IP 06.wsp-gateway.prod.ams1.37705 > intdnsrecurse00.ams1.domain.net.domain: 50275+ SRV? thorondor-ibapi.domain.net. (43)
E..G./@.@.X-
.@.%..?.I.5.3...c...........thorondor-ibapi.domain.net..!..
22:00:17.804711 IP intdnsrecurse00.ams1.domain.net.domain > 06.wsp-gateway.prod.ams1.37705: 50275 1/1/0 CNAME thorondor-ibapi-ams1.domain.net. (143)
E...HK..?.!.%..?
.@..5.I..K..c...........thorondor-ibapi.domain.net..!...............thorondor-ibapi-ams1.............5.ns1.gslb.com..support.domain."......Q.......Q.....
22:00:17.804848 IP 06.wsp-gateway.prod.ams1.52724 > intdnsrecurse02.ams1.domain.net.domain: 15277+ A? thorondor-ibapi.domain.net. (43)
E..G-[@.@...
.@.%..=...5.3..;............thorondor-ibapi.domain.net.....
22:00:17.806476 IP intdnsrecurse02.ams1.domain.net.domain > 06.wsp-gateway.prod.ams1.52724: 15277 2/0/0 CNAME thorondor-ibapi-ams1.domain.net., A 37.252.161.229 (94)
E..z....?...%..=
.@..5...f.U;............thorondor-ibapi.domain.net..................thorondor-ibapi-ams1...7..........%...
22:00:17.806674 IP 06.wsp-gateway.prod.ams1.38922 > intdnsrecurse01.ams1.domain.net.domain: 45384+ AAAA? thorondor-ibapi.domain.net. (43)
E..G].@.@..n
.@.%..>.
.5.3...H...........thorondor-ibapi.domain.net.....
22:00:17.807310 IP intdnsrecurse01.ams1.domain.net.domain > 06.wsp-gateway.prod.ams1.38922: 45384 1/1/0 CNAME thorondor-ibapi-ams1.domain.net. (143)
E...lj..?...%..>
.@..5.
..A\.H...........thorondor-ibapi.domain.net..................thorondor-ibapi-ams1.............5.ns1.gslb.com..support.domain."......Q.......Q.....
22:00:19.030855 IP 06.wsp-gateway.prod.ams1.59842 > intdnsrecurse01.ams1.domain.net.domain: 62071+ SRV? thorondor-ibapi.domain.net. (43)
E..G^.@.@..Q
.@.%..>...5.3...w...........thorondor-ibapi.domain.net..!..
22:00:19.031985 IP intdnsrecurse01.ams1.domain.net.domain > 06.wsp-gateway.prod.ams1.59842: 62071 1/1/0 CNAME thorondor-ibapi-ams1.domain.net. (143)
E...lz..?...%..>
.@..5.....V.w...........thorondor-ibapi.domain.net..!...............thorondor-ibapi-ams1.............5.ns1.gslb.com..support.domain."......Q.......Q.....
22:00:19.032124 IP 06.wsp-gateway.prod.ams1.59705 > intdnsrecurse00.ams1.domain.net.domain: 30151+ A? thorondor-ibapi.domain.net. (43)
E..G.D@.@.X.
.@.%..?.9.5.3..u............thorondor-ibapi.domain.net.....
22:00:19.032676 IP intdnsrecurse00.ams1.domain.net.domain > 06.wsp-gateway.prod.ams1.59705: 30151 2/0/0 CNAME thorondor-ibapi-ams1.domain.net., A 37.252.161.229 (94)
E..z.#..?...%..?
.@..5.9.f6.u............thorondor-ibapi.domain.net..................thorondor-ibapi-ams1...7..........%...
22:00:19.032818 IP 06.wsp-gateway.prod.ams1.57185 > intdnsrecurse02.ams1.domain.net.domain: 39858+ AAAA? thorondor-ibapi.domain.net. (43)
E..G.K@.@...
.@.%..=.a.5.3...............thorondor-ibapi.domain.net.....
22:00:19.034075 IP intdnsrecurse02.ams1.domain.net.domain > 06.wsp-gateway.prod.ams1.57185: 39858 1/1/0 CNAME thorondor-ibapi-ams1.domain.net. (143)
E.......?...%..=
```

**Comment by Tieske** [comment]
can you try to run it with this library from the `0.4.x` branch?

```
git clone https://github.com/Mashape/lua-resty-dns-client.git
git checkout 0.4.x
cd lua-resty-dns-client
luarocks make
```

then restart kong
```
export KONG_LOG_LEVEL=debug
kong restart
```

and check the `error.log` file

**Comment by PFacheris** [comment]
Switched over to using my sand instance for debugging, but the DNS setup for `thorondor-ibapi-sand.adnxs.net` and `thorondor-ibapi.adnxs.net` are the same:
```
2017/05/12 15:26:00 [debug] 25754#0: *644 [lua] client.lua:530: lookup(): [dns-client] querying 'thorondor-ibapi-sand.adnxs.net' for type 5 took 1.9998550415039
2017/05/12 15:26:00 [debug] 25754#0: *644 [lua] client.lua:567: lookup(): [dns-client] querying for 'thorondor-ibapi-sand.adnxs.net' for type 5: entries 0 error nil nil
2017/05/12 15:26:00 [debug] 25754#0: *644 [lua] client.lua:530: lookup(): [dns-client] querying 'thorondor-ibapi-sand.adnxs.net' for type 33 took 1.0001659393311
2017/05/12 15:26:00 [debug] 25754#0: *644 [lua] client.lua:567: lookup(): [dns-client] querying for 'thorondor-ibapi-sand.adnxs.net' for type 33: entries 0 error nil nil
2017/05/12 15:26:00 [debug] 25754#0: *644 [lua] client.lua:530: lookup(): [dns-client] querying 'thorondor-ibapi-sand.adnxs.net' for type 1 took 0.99992752075195
2017/05/12 15:26:00 [debug] 25754#0: *644 [lua] client.lua:567: lookup(): [dns-client] querying for 'thorondor-ibapi-sand.adnxs.net' for type 1: entries 0 error nil nil
2017/05/12 15:26:00 [debug] 25754#0: *644 [lua] client.lua:530: lookup(): [dns-client] querying 'thorondor-ibapi-sand.adnxs.net' for type 28 took 2.000093460083
2017/05/12 15:26:00 [debug] 25754#0: *644 [lua] client.lua:567: lookup(): [dns-client] querying for 'thorondor-ibapi-sand.adnxs.net' for type 28: entries 0 error nil nil
2017/05/12 15:26:00 [error] 25754#0: *644 [lua] responses.lua:107: before(): failed the initial dns/balancer resolve for 'thorondor-ibapi-sand.adnxs.net' with: dns query returned no results, client: 10.3.64.175, server: kong, request: "GET /thorondor/admin/status HTTP/1.1", host: "sand.api.adnxs.com"
2017/05/12 15:26:00 [debug] 25754#0: *644 [lua] base_plugin.lua:28: header_filter(): executing plugin "adnxs-metrics": header_filter
2017/05/12 15:26:00 [debug] 25754#0: *644 [lua] base_plugin.lua:28: header_filter(): executing plugin "statsd": header_filter
2017/05/12 15:26:00 [debug] 25754#0: *644 [lua] base_plugin.lua:32: body_filter(): executing plugin "adnxs-metrics": body_filter
2017/05/12 15:26:00 [debug] 25754#0: *644 [lua] base_plugin.lua:32: body_filter(): executing plugin "statsd": body_filter
2017/05/12 15:26:00 [debug] 25754#0: *644 [lua] base_plugin.lua:32: body_filter(): executing plugin "adnxs-metrics": body_filter
2017/05/12 15:26:00 [debug] 25754#0: *644 [lua] base_plugin.lua:32: body_filter(): executing plugin "statsd": body_filter
2017/05/12 15:26:00 [debug] 25754#0: *644 [lua] base_plugin.lua:36: log(): executing plugin "adnxs-metrics": log
2017/05/12 15:26:00 [debug] 25754#0: *644 [lua] base_plugin.lua:36: log(): executing plugin "statsd": log
2017/05/12 15:26:00 [debug] 25754#0: *648 [lua] statsd_logger.lua:55: counter(): Sending data to statsd server: kong.thorondor_ibapi_default.request.count:1|c
2017/05/12 15:26:00 [debug] 25754#0: *648 [lua] statsd_logger.lua:55: gauge(): Sending data to statsd server: kong.thorondor_ibapi_default.latency:6|g
2017/05/12 15:26:00 [debug] 25754#0: *648 [lua] statsd_logger.lua:55: gauge(): Sending data to statsd server: kong.thorondor_ibapi_default.request.size:104|g
2017/05/12 15:26:00 [debug] 25754#0: *648 [lua] statsd_logger.lua:55: counter(): Sending data to statsd server: kong.thorondor_ibapi_default.request.status.500:1|c
2017/05/12 15:26:00 [debug] 25754#0: *648 [lua] statsd_logger.lua:55: gauge(): Sending data to statsd server: kong.thorondor_ibapi_default.response.size:228|g
2017/05/12 15:26:00 [debug] 25754#0: *648 [lua] statsd_logger.lua:55: gauge(): Sending data to statsd server: kong.thorondor_ibapi_default.upstream_latency:-1|g
2017/05/12 15:26:00 [info] 25754#0: *644 client 10.3.64.175 closed keepalive connection
2017/05/12 15:26:00 [debug] 25754#0: *651 [lua] base_plugin.lua:20: rewrite(): executing plugin "adnxs-metrics": rewrite
2017/05/12 15:26:00 [debug] 25754#0: *651 [lua] base_plugin.lua:20: rewrite(): executing plugin "statsd": rewrite
2017/05/12 15:26:00 [error] 25754#0: *651 [lua] responses.lua:107: before(): failed the initial dns/balancer resolve for 'thorondor-ibapi-sand.adnxs.net' with: dns query returned no results, client: 10.3.64.175, server: kong, request: "GET /thorondor/admin/status HTTP/1.1", host: "sand.api.adnxs.com"
2017/05/12 15:26:00 [debug] 25754#0: *651 [lua] base_plugin.lua:28: header_filter(): executing plugin "adnxs-metrics": header_filter
2017/05/12 15:26:00 [debug] 25754#0: *651 [lua] base_plugin.lua:28: header_filter(): executing plugin "statsd": header_filter
2017/05/12 15:26:00 [debug] 25754#0: *651 [lua] base_plugin.lua:32: body_filter(): executing plugin "adnxs-metrics": body_filter
2017/05/12 15:26:00 [debug] 25754#0: *651 [lua] base_plugin.lua:32: body_filter(): executing plugin "statsd": body_filter
2017/05/12 15:26:00 [debug] 25754#0: *651 [lua] base_plugin.lua:32: body_filter(): executing plugin "adnxs-metrics": body_filter
2017/05/12 15:26:00 [debug] 25754#0: *651 [lua] base_plugin.lua:32: body_filter(): executing plugin "statsd": body_filter
2017/05/12 15:26:00 [debug] 25754#0: *651 [lua] base_plugin.lua:36: log(): executing plugin "adnxs-metrics": log
2017/05/12 15:26:00 [debug] 25754#0: *651 [lua] base_plugin.lua:36: log(): executing plugin "statsd": log
2017/05/12 15:26:00 [debug] 25754#0: *652 [lua] statsd_logger.lua:55: counter(): Sending data to statsd server: kong.thorondor_ibapi_default.request.count:1|c
2017/05/12 15:26:00 [debug] 25754#0: *652 [lua] statsd_logger.lua:55: gauge(): Sending data to statsd server: kong.thorondor_ibapi_default.latency:0|g
2017/05/12 15:26:00 [debug] 25754#0: *652 [lua] statsd_logger.lua:55: gauge(): Sending data to statsd server: kong.thorondor_ibapi_default.request.size:104|g
2017/05/12 15:26:00 [debug] 25754#0: *652 [lua] statsd_logger.lua:55: counter(): Sending data to statsd server: kong.thorondor_ibapi_default.request.status.500:1|c
2017/05/12 15:26:00 [debug] 25754#0: *652 [lua] statsd_logger.lua:55: gauge(): Sending data to statsd server: kong.thorondor_ibapi_default.response.size:228|g
2017/05/12 15:26:00 [debug] 25754#0: *652 [lua] statsd_logger.lua:55: gauge(): Sending data to statsd server: kong.thorondor_ibapi_default.upstream_latency:-1|g
2017/05/12 15:26:00 [info] 25754#0: *651 client 10.3.64.175 closed keepalive connection
2017/05/12 15:26:00 [debug] 25754#0: *655 [lua] base_plugin.lua:20: rewrite(): executing plugin "adnxs-metrics": rewrite
2017/05/12 15:26:00 [debug] 25754#0: *655 [lua] base_plugin.lua:20: rewrite(): executing plugin "statsd": rewrite
2017/05/12 15:26:00 [error] 25754#0: *655 [lua] responses.lua:107: before(): failed the initial dns/balancer resolve for 'thorondor-ibapi-sand.adnxs.net' with: dns query returned no results, client: 10.3.64.175, server: kong, request: "GET /thorondor/admin/status HTTP/1.1", host: "sand.api.adnxs.com"
2017/05/12 15:26:00 [debug] 25754#0: *655 [lua] base_plugin.lua:28: header_filter(): executing plugin "adnxs-metrics": header_filter
2017/05/12 15:26:00 [debug] 25754#0: *655 [lua] base_plugin.lua:28: header_filter(): executing plugin "statsd": header_filter
2017/05/12 15:26:00 [debug] 25754#0: *655 [lua] base_plugin.lua:32: body_filter(): executing plugin "adnxs-metrics": body_filter
2017/05/12 15:26:00 [debug] 25754#0: *655 [lua] base_plugin.lua:32: body_filter(): executing plugin "statsd": body_filter
2017/05/12 15:26:00 [debug] 25754#0: *655 [lua] base_plugin.lua:32: body_filter(): executing plugin "adnxs-metrics": body_filter
2017/05/12 15:26:00 [debug] 25754#0: *655 [lua] base_plugin.lua:32: body_filter(): executing plugin "statsd": body_filter
2017/05/12 15:26:00 [debug] 25754#0: *655 [lua] base_plugin.lua:36: log(): executing plugin "adnxs-metrics": log
2017/05/12 15:26:00 [debug] 25754#0: *655 [lua] base_plugin.lua:36: log(): executing plugin "statsd": log
2017/05/12 15:26:00 [debug] 25754#0: *656 [lua] statsd_logger.lua:55: counter(): Sending data to statsd server: kong.thorondor_ibapi_default.request.count:1|c
2017/05/12 15:26:00 [debug] 25754#0: *656 [lua] statsd_logger.lua:55: gauge(): Sending data to statsd server: kong.thorondor_ibapi_default.latency:0|g
2017/05/12 15:26:00 [debug] 25754#0: *656 [lua] statsd_logger.lua:55: gauge(): Sending data to statsd server: kong.thorondor_ibapi_default.request.size:104|g
2017/05/12 15:26:00 [debug] 25754#0: *656 [lua] statsd_logger.lua:55: counter(): Sending data to statsd server: kong.thorondor_ibapi_default.request.status.500:1|c
2017/05/12 15:26:00 [debug] 25754#0: *656 [lua] statsd_logger.lua:55: gauge(): Sending data to statsd server: kong.thorondor_ibapi_default.response.size:228|g
2017/05/12 15:26:00 [debug] 25754#0: *656 [lua] statsd_logger.lua:55: gauge(): Sending data to statsd server: kong.thorondor_ibapi_default.upstream_latency:-1|g
2017/05/12 15:26:01 [info] 25754#0: *655 client 10.3.64.175 closed keepalive connection
2017/05/12 15:26:01 [debug] 25754#0: *658 [lua] base_plugin.lua:20: rewrite(): executing plugin "adnxs-metrics": rewrite
2017/05/12 15:26:01 [debug] 25754#0: *658 [lua] base_plugin.lua:20: rewrite(): executing plugin "statsd": rewrite
2017/05/12 15:26:01 [error] 25754#0: *658 [lua] responses.lua:107: before(): failed the initial dns/balancer resolve for 'thorondor-ibapi-sand.adnxs.net' with: dns query returned no results, client: 10.3.64.175, server: kong, request: "GET /thorondor/admin/status HTTP/1.1", host: "sand.api.adnxs.com"
2017/05/12 15:26:01 [debug] 25754#0: *658 [lua] base_plugin.lua:28: header_filter(): executing plugin "adnxs-metrics": header_filter
2017/05/12 15:26:01 [debug] 25754#0: *658 [lua] base_plugin.lua:28: header_filter(): executing plugin "statsd": header_filter
2017/05/12 15:26:01 [debug] 25754#0: *658 [lua] base_plugin.lua:32: body_filter(): executing plugin "adnxs-metrics": body_filter
2017/05/12 15:26:01 [debug] 25754#0: *658 [lua] base_plugin.lua:32: body_filter(): executing plugin "statsd": body_filter
2017/05/12 15:26:01 [debug] 25754#0: *658 [lua] base_plugin.lua:32: body_filter(): executing plugin "adnxs-metrics": body_filter
2017/05/12 15:26:01 [debug] 25754#0: *658 [lua] base_plugin.lua:32: body_filter(): executing plugin "statsd": body_filter
2017/05/12 15:26:01 [debug] 25754#0: *658 [lua] base_plugin.lua:36: log(): executing plugin "adnxs-metrics": log
2017/05/12 15:26:01 [debug] 25754#0: *658 [lua] base_plugin.lua:36: log(): executing plugin "statsd": log
2017/05/12 15:26:01 [debug] 25754#0: *659 [lua] statsd_logger.lua:55: counter(): Sending data to statsd server: kong.thorondor_ibapi_default.request.count:1|c
2017/05/12 15:26:01 [debug] 25754#0: *659 [lua] statsd_logger.lua:55: gauge(): Sending data to statsd server: kong.thorondor_ibapi_default.latency:0|g
2017/05/12 15:26:01 [debug] 25754#0: *659 [lua] statsd_logger.lua:55: gauge(): Sending data to statsd server: kong.thorondor_ibapi_default.request.size:104|g
2017/05/12 15:26:01 [debug] 25754#0: *659 [lua] statsd_logger.lua:55: counter(): Sending data to statsd server: kong.thorondor_ibapi_default.request.status.500:1|c
2017/05/12 15:26:01 [debug] 25754#0: *659 [lua] statsd_logger.lua:55: gauge(): Sending data to statsd server: kong.thorondor_ibapi_default.response.size:228|g
2017/05/12 15:26:01 [debug] 25754#0: *659 [lua] statsd_logger.lua:55: gauge(): Sending data to statsd server: kong.thorondor_ibapi_default.upstream_latency:-1|g
2017/05/12 15:26:01 [info] 25754#0: *658 client 10.3.64.175 closed keepalive connection
2017/05/12 15:26:01 [debug] 25758#0: *661 [lua] cluster.lua:20: log(): [cluster] sending keepalive event to datastore
2017/05/12 15:26:01 [debug] 25758#0: *661 [lua] cluster.lua:433: next_coordinator(): [lua-cassandra] load balancing policy chose host at 10.0.113.130
2017/05/12 15:26:01 [debug] 25758#0: *661 [lua] cluster.lua:433: next_coordinator(): [lua-cassandra] load balancing policy chose host at 10.0.113.137
2017/05/12 15:26:01 [debug] 25758#0: *661 [lua] cluster.lua:433: next_coordinator(): [lua-cassandra] load balancing policy chose host at 10.0.113.130
2017/05/12 15:26:01 [debug] 25758#0: *661 [lua] cluster.lua:433: next_coordinator(): [lua-cassandra] load balancing policy chose host at 10.0.113.137
2017/05/12 15:26:01 [debug] 25758#0: *661 [lua] cluster.lua:433: next_coordinator(): [lua-cassandra] load balancing policy chose host at 10.0.113.130
2017/05/12 15:26:01 [debug] 25754#0: *663 [lua] base_plugin.lua:20: rewrite(): executing plugin "adnxs-metrics": rewrite
2017/05/12 15:26:01 [debug] 25754#0: *663 [lua] base_plugin.lua:20: rewrite(): executing plugin "statsd": rewrite
2017/05/12 15:26:01 [debug] 25754#0: *663 [lua] client.lua:530: lookup(): [dns-client] querying 'thorondor-ibapi-sand.adnxs.net' for type 33 took 0.99992752075195
2017/05/12 15:26:01 [debug] 25754#0: *663 [lua] client.lua:567: lookup(): [dns-client] querying for 'thorondor-ibapi-sand.adnxs.net' for type 33: entries 0 error nil nil
2017/05/12 15:26:01 [debug] 25754#0: *663 [lua] client.lua:530: lookup(): [dns-client] querying 'thorondor-ibapi-sand.adnxs.net' for type 1 took 3.000020980835
2017/05/12 15:26:01 [debug] 25754#0: *663 [lua] client.lua:567: lookup(): [dns-client] querying for 'thorondor-ibapi-sand.adnxs.net' for type 1: entries 0 error nil nil
2017/05/12 15:26:01 [debug] 25754#0: *663 [lua] client.lua:530: lookup(): [dns-client] querying 'thorondor-ibapi-sand.adnxs.net' for type 28 took 0.99992752075195
2017/05/12 15:26:01 [debug] 25754#0: *663 [lua] client.lua:567: lookup(): [dns-client] querying for 'thorondor-ibapi-sand.adnxs.net' for type 28: entries 0 error nil nil
2017/05/12 15:26:01 [debug] 25754#0: *663 [lua] base_plugin.lua:24: access(): executing plugin "adnxs-metrics": access
2017/05/12 15:26:01 [debug] 25754#0: *663 [lua] base_plugin.lua:24: access(): executing plugin "statsd": access
2017/05/12 15:26:01 [debug] 25754#0: *663 [lua] base_plugin.lua:28: header_filter(): executing plugin "adnxs-metrics": header_filter
2017/05/12 15:26:01 [debug] 25754#0: *663 [lua] base_plugin.lua:28: header_filter(): executing plugin "statsd": header_filter
2017/05/12 15:26:01 [debug] 25754#0: *663 [lua] base_plugin.lua:32: body_filter(): executing plugin "adnxs-metrics": body_filter
2017/05/12 15:26:01 [debug] 25754#0: *663 [lua] base_plugin.lua:32: body_filter(): executing plugin "statsd": body_filter
2017/05/12 15:26:01 [debug] 25754#0: *663 [lua] base_plugin.lua:32: body_filter(): executing plugin "adnxs-metrics": body_filter
2017/05/12 15:26:01 [debug] 25754#0: *663 [lua] base_plugin.lua:32: body_filter(): executing plugin "statsd": body_filter
2017/05/12 15:26:01 [debug] 25754#0: *663 [lua] base_plugin.lua:36: log(): executing plugin "adnxs-metrics": log
2017/05/12 15:26:01 [debug] 25754#0: *663 [lua] base_plugin.lua:36: log(): executing plugin "statsd": log
2017/05/12 15:26:01 [debug] 25754#0: *667 [lua] statsd_logger.lua:55: Sending data to statsd server: kong.thorondor_ibapi_default.access_latency:5|ms
2017/05/12 15:26:01 [debug] 25754#0: *667 [lua] statsd_logger.lua:55: Sending data to statsd server: kong.thorondor_ibapi_default.rewrite_latency:0|ms
2017/05/12 15:26:01 [debug] 25754#0: *667 [lua] statsd_logger.lua:55: Sending data to statsd server: kong.thorondor_ibapi_default.receive_latency:0|ms
2017/05/12 15:26:01 [debug] 25754#0: *669 [lua] statsd_logger.lua:55: counter(): Sending data to statsd server: kong.thorondor_ibapi_default.request.count:1|c
2017/05/12 15:26:01 [debug] 25754#0: *669 [lua] statsd_logger.lua:55: gauge(): Sending data to statsd server: kong.thorondor_ibapi_default.latency:8|g
2017/05/12 15:26:01 [debug] 25754#0: *669 [lua] statsd_logger.lua:55: gauge(): Sending data to statsd server: kong.thorondor_ibapi_default.request.size:104|g
2017/05/12 15:26:01 [debug] 25754#0: *669 [lua] statsd_logger.lua:55: counter(): Sending data to statsd server: kong.thorondor_ibapi_default.request.status.200:1|c
2017/05/12 15:26:01 [debug] 25754#0: *669 [lua] statsd_logger.lua:55: gauge(): Sending data to statsd server: kong.thorondor_ibapi_default.response.size:183|g
2017/05/12 15:26:01 [debug] 25754#0: *669 [lua] statsd_logger.lua:55: gauge(): Sending data to statsd server: kong.thorondor_ibapi_default.upstream_latency:3|g
2017/05/12 15:26:01 [info] 25754#0: *663 client 10.3.64.175 closed keepalive connection
```

**Comment by PFacheris** [comment]
Update on this:
I worked around this issue by changing the record to be a datacenter aware A record rather than a datacenter aware CNAME.

However, a similar issue started occurring in a single DC with the A record lookups:
```
16:13:22.967372 IP 05.wsp-gateway.prod.ams1.41614 > intdnsrecurse00.ams1.appnexus.net.domain: 63972+ A? thorondor-ibapi-ams1.adnxs.net. (48)
E..L..@.@.)A
.@.%..?...5.8...............thorondor-ibapi-ams1.adnxs.net.....
16:13:22.967795 IP intdnsrecurse00.ams1.appnexus.net.domain > 05.wsp-gateway.prod.ams1.41614: 63972 1/0/0 A 37.252.161.229 (91)
E..w.`..?...%..?
.@..5...c^..............thorondor-ibapi-ams1.adnxs.net......thorondor-ibapi-ams1.aDNXS.'..........%...
16:13:22.967913 IP 05.wsp-gateway.prod.ams1.60919 > intdnsrecurse01.ams1.appnexus.net.domain: 8149+ SRV? thorondor-ibapi-ams1.adnxs.net. (48)
E..L.M@.@.O.
.@.%..>...5.8...............thorondor-ibapi-ams1.adnxs.net..!..
16:13:22.969689 IP 05.wsp-gateway.prod.ams1.32777 > intdnsrecurse01.ams1.appnexus.net.domain: 19982+ PTR? 63.161.252.37.in-addr.arpa. (44)
E..H.N@.@.O.
.@.%..>.        .5.4..N............63.161.252.37.in-addr.arpa.....
16:13:22.970132 IP intdnsrecurse01.ams1.appnexus.net.domain > 05.wsp-gateway.prod.ams1.32777: 19982* 1/0/0 PTR intdnsrecurse00.ams1.appnexus.net. (91)
E..w.G..?...%..>
.@..5.  .c..N............63.161.252.37.in-addr.arpa................#.intdnsrecurse00.ams1.appnexus.net.
16:13:22.990064 IP intdnsrecurse01.ams1.appnexus.net.domain > 05.wsp-gateway.prod.ams1.60919: 8149 0/1/0 (113)
E....+..?...%..>
.@..5...y$W.............thorondor-ibapi-ams1.adnxs.net..!...!.........5.ns1.gslb.com..support.appnexus.'......Q.......Q.....
16:13:22.990267 IP 05.wsp-gateway.prod.ams1.53205 > intdnsrecurse02.ams1.appnexus.net.domain: 4804+ AAAA? thorondor-ibapi-ams1.adnxs.net. (48)
E..L..@.@...
.@.%..=...5.8...............thorondor-ibapi-ams1.adnxs.net.....
16:13:22.991963 IP intdnsrecurse02.ams1.appnexus.net.domain > 05.wsp-gateway.prod.ams1.53205: 4804 0/1/0 (113)
E....9..?...%..=
.@..5...yO..............thorondor-ibapi-ams1.adnxs.net......!.........5.ns1.gslb.com..support.appnexus.'......Q.......Q.....
16:13:22.992065 IP 05.wsp-gateway.prod.ams1.41614 > intdnsrecurse00.ams1.appnexus.net.domain: 60543+ CNAME? thorondor-ibapi-ams1.adnxs.net. (48)
E..L..@.@.)<
.@.%..?...5.8...............thorondor-ibapi-ams1.adnxs.net.....
16:13:22.993817 IP intdnsrecurse00.ams1.appnexus.net.domain > 05.wsp-gateway.prod.ams1.41614: 60543 0/1/0 (113)
E....a..?...%..?
.@..5...y.0.............thorondor-ibapi-ams1.adnxs.net......!.........5.ns1.gslb.com..support.appnexus.'......Q.......Q.....
16:13:24.263603 IP 05.wsp-gateway.prod.ams1.59337 > intdnsrecurse01.ams1.appnexus.net.domain: 3676+ SRV? thorondor-ibapi-ams1.adnxs.net. (48)
E..L.q@.@.M.
.@.%..>...5.8...\...........thorondor-ibapi-ams1.adnxs.net..!..
16:13:24.268319 IP intdnsrecurse01.ams1.appnexus.net.domain > 05.wsp-gateway.prod.ams1.59337: 3676 0/1/0 (113)
E....Y..?...%..>
.@..5...y;..\...........thorondor-ibapi-ams1.adnxs.net..!...!.........5.ns1.gslb.com..support.appnexus.'......Q.......Q.....
16:13:24.268434 IP 05.wsp-gateway.prod.ams1.56479 > intdnsrecurse02.ams1.appnexus.net.domain: 20161+ A? thorondor-ibapi-ams1.adnxs.net. (48)
E..L.M@.@..
.@.%..=...5.8..N............thorondor-ibapi-ams1.adnxs.net.....
16:13:24.270037 IP intdnsrecurse02.ams1.appnexus.net.domain > 05.wsp-gateway.prod.ams1.56479: 20161 1/0/0 A 37.252.161.229 (64)
E..\....?..P%..=```

I've attempted to modify timeout/retry settings in resolv.conf but it doesn't seem to be making a difference. Downgrading to 0.4.0 seems to have resolved both the issue originally described and the A record failure.

**Comment by Tieske** [comment]
@PFacheris I added some more debug info to the `0.4.x` branch. Would you mind giving that another try once more? Thx!

**Comment by PFacheris** [comment]
This is for the CNAME:
```
2017/05/18 16:10:14 [debug] 32211#0: *1134 [lua] client.lua:530: lookup(): [dns-client] querying 'thorondor-ibapi-sand.domain.net' for type 5 took 1.9998550415039
2017/05/18 16:10:14 [debug] 32211#0: *1134 [lua] client.lua:568: lookup(): [dns-client] querying for 'thorondor-ibapi-sand.domain.net' for type 5: entries 0 error nil nil
2017/05/18 16:10:14 [debug] 32211#0: *1134 [lua] client.lua:530: lookup(): [dns-client] querying 'thorondor-ibapi-sand.domain.net' for type 33 took 2.000093460083
2017/05/18 16:10:14 [debug] 32211#0: *1134 [lua] client.lua:568: lookup(): [dns-client] querying for 'thorondor-ibapi-sand.domain.net' for type 33: entries 0 error nil nil
2017/05/18 16:10:14 [debug] 32211#0: *1134 [lua] client.lua:530: lookup(): [dns-client] querying 'thorondor-ibapi-sand.domain.net' for type 1 took 3.000020980835
2017/05/18 16:10:14 [debug] 32211#0: *1134 [lua] client.lua:543: lookup(): [dns-client] removing: 1:thorondor-ibapi-nym2-sand.domain.net (name or type mismatch)
2017/05/18 16:10:14 [debug] 32211#0: *1134 [lua] client.lua:543: lookup(): [dns-client] removing: 5:thorondor-ibapi-sand.domain.net (name or type mismatch)
2017/05/18 16:10:14 [debug] 32211#0: *1134 [lua] client.lua:568: lookup(): [dns-client] querying for 'thorondor-ibapi-sand.domain.net' for type 1: entries 0 error nil nil
2017/05/18 16:10:14 [debug] 32211#0: *1134 [lua] client.lua:530: lookup(): [dns-client] querying 'thorondor-ibapi-sand.domain.net' for type 28 took 0.99992752075195
2017/05/18 16:10:14 [debug] 32211#0: *1134 [lua] client.lua:568: lookup(): [dns-client] querying for 'thorondor-ibapi-sand.domain.net' for type 28: entries 0 error nil nil
2017/05/18 16:10:14 [error] 32211#0: *1134 [lua] responses.lua:107: before(): failed the initial dns/balancer resolve for 'thorondor-ibapi-sand.domain.net' with: dns query returned no results, client: 10.3.64.175, server: kong, request: "GET /thorondor/admin/status HTTP/1.1", host: "sand.api.domain.com"
 
…. finally resolved
 
2017/05/18 16:10:15 [debug] 32211#0: *1174 [lua] client.lua:530: lookup(): [dns-client] querying 'thorondor-ibapi-sand.domain.net' for type 33 took 3.000020980835
2017/05/18 16:10:15 [debug] 32211#0: *1174 [lua] client.lua:543: lookup(): [dns-client] removing: 5:thorondor-ibapi-sand.domain.net (name or type mismatch)
2017/05/18 16:10:15 [debug] 32211#0: *1174 [lua] client.lua:568: lookup(): [dns-client] querying for 'thorondor-ibapi-sand.domain.net' for type 33: entries 0 error nil nil
2017/05/18 16:10:15 [debug] 32211#0: *1174 [lua] client.lua:530: lookup(): [dns-client] querying 'thorondor-ibapi-sand.domain.net' for type 1 took 1.9998550415039
2017/05/18 16:10:15 [debug] 32211#0: *1174 [lua] client.lua:543: lookup(): [dns-client] removing: 1:thorondor-ibapi-nym2-sand.domain.net (name or type mismatch)
2017/05/18 16:10:15 [debug] 32211#0: *1174 [lua] client.lua:543: lookup(): [dns-client] removing: 5:thorondor-ibapi-sand.domain.net (name or type mismatch)
2017/05/18 16:10:15 [debug] 32211#0: *1174 [lua] client.lua:568: lookup(): [dns-client] querying for 'thorondor-ibapi-sand.domain.net' for type 1: entries 0 error nil nil
2017/05/18 16:10:15 [debug] 32211#0: *1174 [lua] client.lua:530: lookup(): [dns-client] querying 'thorondor-ibapi-sand.domain.net' for type 28 took 2.000093460083
2017/05/18 16:10:15 [debug] 32211#0: *1174 [lua] client.lua:543: lookup(): [dns-client] removing: 5:thorondor-ibapi-sand.domain.net (name or type mismatch)
2017/05/18 16:10:15 [debug] 32211#0: *1174 [lua] client.lua:568: lookup(): [dns-client] querying for 'thorondor-ibapi-sand.domain.net' for type 28: entries 0 error nil nil
```

and for the A:

```
2017/05/18 16:28:12 [debug] 19749#0: *912 [lua] client.lua:530: lookup(): [dns-client] querying 'thorondor-ibapi-ams1.domain.net' for type 1 took 0.99992752075195
2017/05/18 16:28:12 [debug] 19749#0: *912 [lua] client.lua:543: lookup(): [dns-client] removing: 1:thorondor-ibapi-ams1.domain.net (name or type mismatch)
2017/05/18 16:28:12 [debug] 19749#0: *912 [lua] client.lua:568: lookup(): [dns-client] querying for 'thorondor-ibapi-ams1.domain.net' for type 1: entries 0 error nil nil
2017/05/18 16:28:12 [debug] 19749#0: *912 [lua] client.lua:530: lookup(): [dns-client] querying 'thorondor-ibapi-ams1.domain.net' for type 33 took 1.0001659393311
2017/05/18 16:28:12 [debug] 19749#0: *912 [lua] client.lua:568: lookup(): [dns-client] querying for 'thorondor-ibapi-ams1.domain.net' for type 33: entries 0 error nil nil
2017/05/18 16:28:12 [debug] 19749#0: *912 [lua] client.lua:530: lookup(): [dns-client] querying 'thorondor-ibapi-ams1.domain.net' for type 28 took 1.9998550415039
2017/05/18 16:28:12 [debug] 19749#0: *912 [lua] client.lua:568: lookup(): [dns-client] querying for 'thorondor-ibapi-ams1.domain.net' for type 28: entries 0 error nil nil
2017/05/18 16:28:12 [debug] 19749#0: *912 [lua] client.lua:530: lookup(): [dns-client] querying 'thorondor-ibapi-ams1.domain.net' for type 5 took 2.000093460083
2017/05/18 16:28:12 [debug] 19749#0: *912 [lua] client.lua:568: lookup(): [dns-client] querying for 'thorondor-ibapi-ams1.domain.net' for type 5: entries 0 error nil nil

… during failures

2017/05/18 16:28:13 [debug] 19749#0: *932 [lua] client.lua:530: lookup(): [dns-client] querying 'thorondor-ibapi-ams1.domain.net' for type 33 took 0.99992752075195
2017/05/18 16:28:13 [debug] 19749#0: *932 [lua] client.lua:568: lookup(): [dns-client] querying for 'thorondor-ibapi-ams1.domain.net' for type 33: entries 0 error nil nil
2017/05/18 16:28:13 [debug] 19749#0: *932 [lua] client.lua:530: lookup(): [dns-client] querying 'thorondor-ibapi-ams1.domain.net' for type 1 took 0
2017/05/18 16:28:13 [debug] 19749#0: *932 [lua] client.lua:543: lookup(): [dns-client] removing: 1:thorondor-ibapi-ams1.domain.net (name or type mismatch)
2017/05/18 16:28:13 [debug] 19749#0: *932 [lua] client.lua:568: lookup(): [dns-client] querying for 'thorondor-ibapi-ams1.domain.net' for type 1: entries 0 error nil nil
2017/05/18 16:28:13 [debug] 19749#0: *932 [lua] client.lua:530: lookup(): [dns-client] querying 'thorondor-ibapi-ams1.domain.net' for type 28 took 0.99992752075195
2017/05/18 16:28:13 [debug] 19749#0: *932 [lua] client.lua:568: lookup(): [dns-client] querying for 'thorondor-ibapi-ams1.domain.net' for type 28: entries 0 error nil nil
2017/05/18 16:28:13 [debug] 19749#0: *932 [lua] client.lua:530: lookup(): [dns-client] querying 'thorondor-ibapi-ams1.domain.net' for type 5 took 1.0001659393311
2017/05/18 16:28:13 [debug] 19749#0: *932 [lua] client.lua:568: lookup(): [dns-client] querying for 'thorondor-ibapi-ams1.domain.net' for type 5: entries 0 error nil nil
2017/05/18 16:28:13 [error] 19749#0: *932 [lua] responses.lua:107: before(): failed the initial dns/balancer resolve for 'thorondor-ibapi-ams1.domain.net' with: dns query returned no results, client: 10.3.64.175, server: kong, request: "GET /thorondor/admin/status HTTP/1.1", host: "ams1-api.domain.com"

… finally resolved

2017/05/18 16:28:14 [debug] 19749#0: *957 [lua] client.lua:530: lookup(): [dns-client] querying 'thorondor-ibapi-ams1.domain.net' for type 33 took 2.000093460083
2017/05/18 16:28:14 [debug] 19749#0: *957 [lua] client.lua:568: lookup(): [dns-client] querying for 'thorondor-ibapi-ams1.domain.net' for type 33: entries 0 error nil nil
2017/05/18 16:28:14 [debug] 19749#0: *957 [lua] client.lua:530: lookup(): [dns-client] querying 'thorondor-ibapi-ams1.domain.net' for type 1 took 1.9998550415039
2017/05/18 16:28:14 [debug] 19749#0: *957 [lua] client.lua:568: lookup(): [dns-client] querying for 'thorondor-ibapi-ams1.domain.net' for type 1: entries 1 error nil nil
```

I only included the lookup info before/during/after. Let me know if you need more.

**Comment by Tieske** [comment]
@PFacheris it doesn't make sense to me.

Where the log says "removing" it means that the query results do not match the query directly (either a different type or name is reported). Those results are stored in the cache and removed from the answer. Such that when it falls through to the next type, it will immediately find them in the cache and return, without reaching out to the nameserver again.

The `CNAME` block you gave above tries;

- type 5 (`CNAME`) which fails
- type 33 (`SRV`) which fails
- type 1 (`A`) which returns an `A` record by a different name, but also returns a `CNAME` by the same name that failed in the first try, which was a `CNAME` query???
- type 28 (`AAAA`)

The default order is to query for `LAST, SRV, A, AAAA, CNAME` (where `LAST` is the last successful lookup) so the last successful seemed to be the `CNAME`, as that is what it starts with.
Question is why does the `CNAME` lookup here fail?

Can you provide me the full log from the reload/restart upto and including the errors? (gist maybe)

**Comment by PFacheris** [comment]
Hmm, that is odd.

Here are the full logs, I start sending requests at Thu May 18 20:52:18 UTC 2017 and the error is first encountered at Thu May 18 20:52:48 UTC 2017: https://gist.github.com/PFacheris/dcd3034130cfe1199d2a28b8800b7803

**Comment by Tieske** [comment]
@PFacheris thx! will have a close look at those.

Meanwhile I spotted an anomaly in the A logs you sent previously as well. I updated the `0.4.x` branch again. Can you try that for the A record again?

thank you very much for your help in debugging this :+1:

**Comment by PFacheris** [comment]
PM'd you on gitter, but for visibility:
I've potentially discovered the problem with the A record case that wasn't detectable in my last log because I was substituting internal domains (changed here but maintaining capitalization to demonstrate the issue):
```
2017/05/18 22:12:32 [debug] 17716#0: *980 [lua] client.lua:530: lookup(): [dns-client] querying 'thorondor-ibapi-ams1.api.net' for type 33(number) took 5.000114440918
2017/05/18 22:12:32 [debug] 17716#0: *980 [lua] client.lua:568: lookup(): [dns-client] querying 'thorondor-ibapi-ams1.api.net' for type 33(number): entries 0 error nil nil
2017/05/18 22:12:32 [debug] 17716#0: *980 [lua] client.lua:530: lookup(): [dns-client] querying 'thorondor-ibapi-ams1.api.net' for type 1(number) took 0.99992752075195
2017/05/18 22:12:32 [debug] 17716#0: *980 [lua] client.lua:543: lookup(): [dns-client] removing: 1(number):thorondor-ibapi-ams1.aPI.net (name or type mismatch)
```
Specifically one of our nameservers in the rotation for that DC is returning `.aPI.net` instead of `.api.net`. I think the A record issue will be fixed by making comparison between qname and answer.name case insensitive.

(And always happy to help with debugging 😄)

**Comment by Tieske** [comment]
thx. The case sensitivity ought to be fixed in a new update on the `0.4.x` branch

**Comment by Tieske** [comment]
The default lookup order is LAST, SRV, A, AAAA, CNAME (where LAST means the previous successful lookup type)

So going through the logs, what is happening here:
```
2017/05/18 20:52:18 [debug] 14999#0: *296 [lua] client.lua:530: lookup(): [dns-client] querying 'thorondor-ibapi-sand.domain.net' for type 33 took 2.000093460083
2017/05/18 20:52:18 [debug] 14999#0: *296 [lua] client.lua:568: lookup(): [dns-client] querying for 'thorondor-ibapi-sand.domain.net' for type 33: entries 0 error nil nil
```
This is the first lookup, so there is no LAST set yet. A query type 33 == SRV is performed and it finds 0 entries, hence falls through to the next
```
2017/05/18 20:52:18 [debug] 14999#0: *296 [lua] client.lua:530: lookup(): [dns-client] querying 'thorondor-ibapi-sand.domain.net' for type 1 took 3.000020980835
2017/05/18 20:52:18 [debug] 14999#0: *296 [lua] client.lua:543: lookup(): [dns-client] removing: 1:thorondor-ibapi-nym2-sand.domain.net (name or type mismatch)
2017/05/18 20:52:18 [debug] 14999#0: *296 [lua] client.lua:543: lookup(): [dns-client] removing: 5:thorondor-ibapi-sand.domain.net (name or type mismatch)
2017/05/18 20:52:18 [debug] 14999#0: *296 [lua] client.lua:568: lookup(): [dns-client] querying for 'thorondor-ibapi-sand.domain.net' for type 1: entries 0 error nil nil
```
So now we try the A record (type 1). Here we get 2 non requested results, an A record for a different name, and a CNAME record (pointing to the aforementiond A record).
These entries are removed and stored in the dns cache, final result is 0 entries because non matches both the requested name and type.
```
2017/05/18 20:52:18 [debug] 14999#0: *296 [lua] client.lua:530: lookup(): [dns-client] querying 'thorondor-ibapi-sand.domain.net' for type 28 took 1.9998550415039
2017/05/18 20:52:18 [debug] 14999#0: *296 [lua] client.lua:568: lookup(): [dns-client] querying for 'thorondor-ibapi-sand.domain.net' for type 28: entries 0 error nil nil
```
Next up is the AAAA record (type 28), which also results in 0 entries.

What is not visible here is that after the AAAA fails, the next one is the CNAME. The CNAME will immediately succeed because it was cached when we got the results from the A try above. Dereferencing that CNAME is also done from the cache as it points to the alternative A record also cached with the A lookup before.

(cache hits are not logged because of the hot code path)


Now 30 seconds later the TTL expires and we restart the whole process
```
2017/05/18 20:52:48 [debug] 14999#0: *1373 [lua] client.lua:530: lookup(): [dns-client] querying 'thorondor-ibapi-sand.domain.net' for type 5 took 1.9998550415039
2017/05/18 20:52:48 [debug] 14999#0: *1373 [lua] client.lua:568: lookup(): [dns-client] querying for 'thorondor-ibapi-sand.domain.net' for type 5: entries 0 error nil nil
```
Now our LAST type is the CNAME type we lookup up for this name previously, so that is where we start. But here, nothing is returned, 0 entries... previously we got a CNAME along with the A query, but explicitly requesting a CNAME, doesn't return it???

```
2017/05/18 20:52:48 [debug] 14999#0: *1373 [lua] client.lua:530: lookup(): [dns-client] querying 'thorondor-ibapi-sand.domain.net' for type 33 took 4.000186920166
2017/05/18 20:52:48 [debug] 14999#0: *1373 [lua] client.lua:543: lookup(): [dns-client] removing: 5:thorondor-ibapi-sand.domain.net (name or type mismatch)
2017/05/18 20:52:48 [debug] 14999#0: *1373 [lua] client.lua:568: lookup(): [dns-client] querying for 'thorondor-ibapi-sand.domain.net' for type 33: entries 0 error nil nil
```
So here we tried SRV again, with an odd result, because this time it returns a CNAME (in our previous try 30 seconds ago it didn't return it). It wasn't requested so is removed and 0 entries remain.
```
2017/05/18 20:52:48 [debug] 14999#0: *1373 [lua] client.lua:530: lookup(): [dns-client] querying 'thorondor-ibapi-sand.domain.net' for type 1 took 1.9998550415039
2017/05/18 20:52:48 [debug] 14999#0: *1373 [lua] client.lua:543: lookup(): [dns-client] removing: 1:thorondor-ibapi-nym2-sand.domain.net (name or type mismatch)
2017/05/18 20:52:48 [debug] 14999#0: *1373 [lua] client.lua:543: lookup(): [dns-client] removing: 5:thorondor-ibapi-sand.domain.net (name or type mismatch)
2017/05/18 20:52:48 [debug] 14999#0: *1373 [lua] client.lua:568: lookup(): [dns-client] querying for 'thorondor-ibapi-sand.domain.net' for type 1: entries 0 error nil nil
```
Next up is looking for an A record again, this delivers the exact same results as in our previous try, so this is as expected.
```
2017/05/18 20:52:48 [debug] 14999#0: *1373 [lua] client.lua:530: lookup(): [dns-client] querying 'thorondor-ibapi-sand.domain.net' for type 28 took 2.000093460083
2017/05/18 20:52:48 [debug] 14999#0: *1373 [lua] client.lua:543: lookup(): [dns-client] removing: 5:thorondor-ibapi-sand.domain.net (name or type mismatch)
2017/05/18 20:52:48 [debug] 14999#0: *1373 [lua] client.lua:568: lookup(): [dns-client] querying for 'thorondor-ibapi-sand.domain.net' for type 28: entries 0 error nil nil
```
Now looking for an AAAA and again, as opposed to our first try 30 seconds ago, we get the CNAME delivered... why that change?
```
2017/05/18 20:52:48 [error] 14999#0: *1373 [lua] responses.lua:107: before(): failed the initial dns/balancer resolve for 'thorondor-ibapi-sand.domain.net' with: dns query returned no results, client: 10.3.64.175, server: kong, request: "GET /thorondor/admin/status HTTP/1.1", host: "sand.api.domain.com"
```
And here we fail. The CNAME was not tried again, as it was the first type tried (as LAST) and we see no use in trying that again. But the end result here is that we could not resolve the name.

So all in all, I don't know what's going on here. Seems the name server is randomly adding and removing CNAME records to some queries, but not returning it when explicitly requested.

My expectations:

- for an A query: return the CNAME and final A record as well (this appears to happen consistently)
- for a CNAME query: return the CNAME and the final A record

@PFacheris Thoughts?

**Comment by PFacheris** [comment]
A record issue is resolved with that update, thanks!

That does appear to be wrong @Tieske, perhaps it's something non-standard with our internal DNS mechanisms. I'll investigate this and track down why it's happening and if it can be changed.

**Comment by Tieske** [comment]
thinking about this: the upper/lower case issue was due to multiple nameservers being used, right? could this also be the case with the CNAME records?

When querying a random nameserver is picked by the dns library. You could try to configure Kong explicitly with a single nameserver, this should consistently return the same results for the queries.

**Comment by PFacheris** [comment]
Definitely possible. Closing this for now though as I'm working around the issue internally. Was an issue with our DNS setup only implementing a subset of the DNS protocol.

As a final thing, could I also request a new tag for the A record fix so I can begin using that? Thanks for the help tracking this down.

**Comment by Tieske** [comment]
@PFacheris Kong 0.10.3 is expected shortly, probably this week.

Did you have any luck with the cname related issue, if configuring Kong to use a single name server? (testing whether the discrepancies listed above are originating from one (or more) name servers that are badly configured)

**Comment by PFacheris** [comment]
@Tieske Awesome, happy to hear.

Same issue when using a single name server and with the luarock built from master (though now only a single error every 30 seconds instead of multiple). Think it's just because we take a half-baked, roll your own DNS approach that's inconsistently incorrect even with a single nameserver (for ex. dig with a single nameserver sometimes returns a CNAME for an AAAA qtype and sometimes not 😞). At the very least it's consistent about A records so can work around this for now with the next release until we tackle some of the internal DNS tech debt.

I get the impression it was mostly luck that our setup was working in previous versions.

**Comment by PFacheris** [comment]
@Tieske Seems the A record fix didn't make it into the Kong release, so still blocked on turning traffic to Kong back on unfortunately. Also discovered that the nameservers returning answers with seemingly random capitalization relates to https://dyn.com/blog/use-of-bit-0x20-in-dns-labels/ (https://tools.ietf.org/html/draft-vixie-dnsext-dns0x20-00) and they weren't misconfigured as I initially assumed.

**Comment by PFacheris** [comment]
I see it's in there now, thanks. 😄

**Comment by Tieske** [comment]
@PFacheris just to let you know, we had a similar issue with a customer and it turned out the dns servers were not in line, one responded different from the others. So that might still be the case with your setup as well.

**Comment by kmokrzycki** [comment]
Same problem happened to me where every now and than I received: 
`{“message”:“name resolution failed”}`

We had to make sure there is only one DNS entry in kong.config :  
`dns_resolver = 172.17.0.1`

**Comment by Tieske** [comment]
@kmokrzycki you can have multiple dns servers, that should not be a problem. It only is a problem if the servers do not respond identical.

If anything else happened, then that would be a bug.

**Comment by kmokrzycki** [comment]
Thanks @Tieske 
what would be considered to be different response and why does it matter ? 

`
; <<>> DiG 9.8.2rc1-RedHat-9.8.2-0.68.rc1.59.amzn1 <<>> facade-auth-live.gc.company.com @10.22.20.2
;; global options: +cmd
;; Got answer:
;; ->>HEADER<<- opcode: QUERY, status: NOERROR, id: 61477
;; flags: qr rd ra; QUERY: 1, ANSWER: 2, AUTHORITY: 4, ADDITIONAL: 0

;; QUESTION SECTION:
;facade-auth-live.gc.company.com. IN  A

;; ANSWER SECTION:
facade-auth-live.gc.company.com. 60 IN A      10.249.73.7
facade-auth-live.gc.company.com. 60 IN A      10.249.72.233

;; AUTHORITY SECTION:
gc.company.com.       172800  IN      NS      ns-512.awsdns-00.net.
gc.company.com.       172800  IN      NS      ns-0.awsdns-00.com.
gc.company.com.       172800  IN      NS      ns-1024.awsdns-00.org.
gc.company.com.       172800  IN      NS      ns-1536.awsdns-00.co.uk.

;; Query time: 2 msec
;; SERVER: 10.22.20.2#53(10.22.20.2)
;; WHEN: Wed May 15 14:52:49 2019
;; MSG SIZE  rcvd: 218
`

vs 

`
; <<>> DiG 9.8.2rc1-RedHat-9.8.2-0.68.rc1.59.amzn1 <<>> facade-auth-live.gc.company.com @localhost
;; global options: +cmd
;; Got answer:
;; ->>HEADER<<- opcode: QUERY, status: NOERROR, id: 38990
;; flags: qr rd ra; QUERY: 1, ANSWER: 2, AUTHORITY: 4, ADDITIONAL: 8

;; QUESTION SECTION:
;facade-auth-live.gc.company.com. IN  A

;; ANSWER SECTION:
facade-auth-live.gc.company.com. 60 IN A      10.249.73.7
facade-auth-live.gc.company.com. 60 IN A      10.249.72.233

;; AUTHORITY SECTION:
gc.company.com.       148825  IN      NS      ns-1536.awsdns-00.co.uk.
gc.company.com.       148825  IN      NS      ns-512.awsdns-00.net.
gc.company.com.       148825  IN      NS      ns-0.awsdns-00.com.
gc.company.com.       148825  IN      NS      ns-1024.awsdns-00.org.

;; ADDITIONAL SECTION:
ns-1024.awsdns-00.org.  96164   IN      A       205.251.196.0
ns-1024.awsdns-00.org.  144652  IN      AAAA    2600:9000:5304::1
ns-1536.awsdns-00.co.uk. 73197  IN      A       205.251.198.0
ns-1536.awsdns-00.co.uk. 79368  IN      AAAA    2600:9000:5306::1
ns-512.awsdns-00.net.   95207   IN      A       205.251.194.0
ns-512.awsdns-00.net.   137981  IN      AAAA    2600:9000:5302::1
ns-0.awsdns-00.com.     75442   IN      A       205.251.192.0
ns-0.awsdns-00.com.     144163  IN      AAAA    2600:9000:5300::1
`

**Comment by Tieske** [comment]
@kmokrzycki in the issue by the OP, there seem to be random results, occasionally the CNAME is returned, and occasionally not. This indicates that there are multiple dns servers (which are randomly picked) and they respond differently. Some have CNAME's others don't, and that is a bad DNS config.

The differences posted by you seem innocent, since the answer records are according to the query, no CNAME's.

That does make me curious for your errors though? Can you provide debug logs for the case where you have multiple dns servers configured?
